{
  "fn": "gccEngine",
  "type": "deterministic",
  "layer": "L3",
  "owner_agent": "Intraktom",
  "contract": { "input": "schemas/CompatibilityArtifact.v1.json", "output": "schemas/gcc.out.json" },
  "determinism": { "runs": 2, "compare": "bytes" },
  "edge_cases": ["empty", "single", "two", "identical", "one-invalid", "extremes"],
  "stress": { "n": 1000, "assert": ["noNaN", "inRange", "time<2ms"] },
  "golden": [{ "id": "smfk100.core-team.v1", "input": "fixtures/smfk100.team.json", "expect": { "Gcc": [0.842491, 0.842491] } }, { "id": "fail-closed-n<3", "expect": { "status": "missing" } }],
  "eval": { "judge": false, "rubric": null },
  "guardrails": { "channel_missing": "badge:⛔", "disclaimer": "Functional complementarity heuristic. Not a clinical compatibility test." },
  "telemetry": ["n", "duration"],
  "ui_contract": { "component": "Radar", "badge_policy": "🟢" },
  "status": "green",
  "version": "1.0.0"
}
